{
  "$schema": "http://json-schema.org/draft-07/schema#",
  "type": [
    "object",
    "null"
  ],
  "properties": {
    "headerId": {
      "type": "integer"
    },
    "loads": {
      "type": "array",
      "items": {
        "type": "object",
        "properties": {
          "loadType": {
            "type": "string"
          },
          "loadId": {
            "type": "string"
          },
          "loadPosition": {
            "type": "string"
          },
          "loadTimestamp": {
            "type": "integer"
          },
          "type": {
            "type": "string"
          },
          "duration": {
            "type": "integer"
          }
        }
      }
    },
    "actionState": {
      "anyOf": [
        {
          "type": "null"
        },
        {
          "type": "object",
          "properties": {
            "command": {
              "type": "string"
            },
            "id": {
              "type": "string"
            },
            "metadata": {
              "type": "object",
              "properties": {
                "type": {
                  "type": "string"
                },
                "workpieceId": {
                  "type": "string"
                },
                "position": {
                  "type": "string"
                },
                "references": {
                  "type": "array",
                  "items": {
                    "type": "object",
                    "properties": {
                      "referenceKey": {
                        "type": "string"
                      },
                      "referenceValue": {
                        "type": "integer"
                      }
                    },
                    "required": [
                      "referenceKey",
                      "referenceValue"
                    ]
                  }
                },
                "green": {
                  "type": "boolean"
                },
                "red": {
                  "type": "boolean"
                },
                "yellow": {
                  "type": "boolean"
                }
              }
            },
            "state": {
              "type": "string"
            },
            "timestamp": {
              "type": "string"
            },
            "result": {
              "type": ["string", "null"]
            },
            "duration": {
              "type": "integer"
            }
          },
          "required": [
            "id",
            "state"
          ]
        }
      ]
    },
    "serialNumber": {
      "type": "string"
    },
    "timestamp": {
      "type": "string"
    },
    "errors": {
      "type": "array",
      "items": {
        "type": "object",
        "properties": {
          "timestamp": {
            "type": "string"
          },
          "errorType": {
            "type": "string"
          },
          "errorMessage": {
            "type": "string"
          },
          "errorLevel": {
            "type": "string"
          },
          "errorReferences": {
            "type": "array",
            "items": {
              "type": "object",
              "properties": {
                "topic": {
                  "type": "string"
                },
                "headerId": {
                  "type": ["integer", "null"]
                },
                "orderId": {
                  "type": ["string", "null"]
                },
                "orderUpdateId": {
                  "type": "integer"
                }
              }
            }
          }
        }
      }
    },
    "orderUpdateId": {
      "type": [
        "integer",
        "string"
      ]
    },
    "orderId": {
      "type": [
        "integer",
        "string"
      ]
    },
    "paused": {
      "type": "boolean"
    },
    "metadata": {
      "type": "object",
      "properties": {
        "opcuaState": {
          "type": "string"
        }
      },
      "required": [
        "opcuaState"
      ]
    },
    "operatingMode": {
      "type": "string"
    },
    "information": {
      "type": "array",
      "items": {
        "type": "object",
        "properties": {
          "infoType": {
            "type": "string"
          },
          "infoLevel": {
            "type": "string"
          },
          "infoReferences": {
            "type": "array",
            "items": {
              "type": "object",
              "properties": {
                "referenceKey": {
                  "type": "string"
                },
                "referenceValue": {
                  "type": [
                    "integer",
                    "string"
                  ]
                }
              },
              "required": [
                "referenceKey",
                "referenceValue"
              ]
            }
          }
        },
        "required": [
          "infoLevel",
          "infoReferences",
          "infoType"
        ]
      }
    },
    "batteryState": {
      "type": "object"
    },
    "actionStates": {
      "type": "array",
      "items": {
        "type": "object",
        "properties": {
          "timestamp": {
            "type": "string"
          },
          "id": {
            "type": "string"
          },
          "metadata": {
            "type": "object",
            "properties": {
              "workpiece": {
                "type": "object",
                "properties": {
                  "workpieceId": {
                    "type": "string"
                  },
                  "history": {
                    "type": "array",
                    "items": {
                      "type": "object",
                      "properties": {
                        "code": {
                          "type": "integer"
                        },
                        "ts": {
                          "type": "integer"
                        }
                      },
                      "required": [
                        "code",
                        "ts"
                      ]
                    }
                  },
                  "type": {
                    "type": "string"
                  },
                  "state": {
                    "type": "string"
                  }
                },
                "required": [
                  "history",
                  "state",
                  "type",
                  "workpieceId"
                ]
              }
            },
            "required": []
          },
          "state": {
            "type": "string"
          },
          "command": {
            "type": "string"
          },
          "result": {
            "type": ["string", "null"]
          },
          "warning": {
            "type": "boolean"
          }
        },
        "required": [
          "command",
          "id",
          "state"
        ]
      }
    }
  },
  "required": [
    "actionState",
    "errors",
    "headerId",
    "orderUpdateId",
    "paused",
    "serialNumber",
    "timestamp"
  ],
  "title": "Module_V1_Ff_Serial_State Schema",
  "description": "Granular schema for module_v1_ff_serial_state topics from 252 examples",
  "category": "module",
  "additionalProperties": true
}