{
  "headerId": 716,
  "loads": [
    {
      "type": "RED"
    }
  ],
  "actionState": {
    "result": "040a8dca341291",
    "id": "0",
    "timestamp": "2025-10-01T09:58:05.758519Z",
    "metadata": {
      "type": "RED"
    },
    "command": "RGB_NFC",
    "state": "FINISHED"
  },
  "serialNumber": "SVR4H73275",
  "timestamp": "2025-10-01T09:58:06.778Z",
  "errors": [
    {}
  ],
  "orderUpdateId": 0,
  "orderId": "0",
  "paused": false,
  "metadata": {
    "opcuaState": "connected"
  }
}