{
  "headerId": 12,
  "loads": [
    {
      "loadType": "WHITE",
      "loadId": "047c8bca341291",
      "loadPosition": "A1",
      "loadTimestamp": 1759306017560
    },
    {
      "loadType": "",
      "loadId": "",
      "loadPosition": "A2",
      "loadTimestamp": 0
    },
    {
      "loadType": "",
      "loadId": "",
      "loadPosition": "A3",
      "loadTimestamp": 0
    },
    {
      "loadType": "WHITE",
      "loadId": "047b8bca341291",
      "loadPosition": "B1",
      "loadTimestamp": 1759312460464
    },
    {
      "loadType": "RED",
      "loadId": "040a8dca341291",
      "loadPosition": "B2",
      "loadTimestamp": 1759312722565
    },
    {
      "loadType": "WHITE",
      "loadId": "04798eca341290",
      "loadPosition": "B3",
      "loadTimestamp": 1759220882441
    },
    {
      "loadType": "BLUE",
      "loadId": "047389ca341291",
      "loadPosition": "C1",
      "loadTimestamp": 1759313206785
    },
    {
      "loadType": "",
      "loadId": "",
      "loadPosition": "C2",
      "loadTimestamp": 0
    },
    {
      "loadType": "RED",
      "loadId": "04808dca341291",
      "loadPosition": "C3",
      "loadTimestamp": 1759221461166
    }
  ],
  "actionState": {
    "id": "261b0b0e-2e36-496c-b023-6f7c3742565b",
    "command": "DROP",
    "metadata": {
      "type": "RED"
    },
    "state": "FINISHED",
    "result": "04fa8cca341290"
  },
  "serialNumber": "SVR3QA0022",
  "timestamp": "2025-10-01T10:13:15.544Z",
  "errors": [],
  "orderUpdateId": 1,
  "orderId": "0f77cfd1-c4ec-4e5f-8262-d9de2add939a",
  "paused": false,
  "operatingMode": "AUTOMATIC",
  "metadata": {
    "opcuaState": "connected"
  },
  "information": []
}