{
  "headerId": 81,
  "loads": [
    {
      "loadType": "RED"
    }
  ],
  "actionState": {
    "id": "4dabbbf3-60d4-452f-9e6d-1ff0bcee38db",
    "state": "RUNNING",
    "command": "PICK",
    "duration": 5
  },
  "serialNumber": "SVR3QA2098",
  "timestamp": "2025-10-01T11:22:41.585Z",
  "errors": [],
  "orderUpdateId": 3,
  "orderId": "5acf1a80-07e7-4c80-a128-e6739e681665",
  "paused": false,
  "metadata": {
    "opcuaState": "connected"
  }
}