{
  "headerId": 244,
  "loads": [
    {
      "loadType": "UNKNOWN"
    }
  ],
  "actionState": null,
  "serialNumber": "SVR4H73275",
  "timestamp": "2025-10-01T11:14:15.076Z",
  "errors": [],
  "orderUpdateId": 0,
  "orderId": "0",
  "paused": false,
  "metadata": {
    "opcuaState": "connected"
  }
}