{
  "headerId": 136,
  "loads": [
    {
      "loadType": "WHITE",
      "loadId": "047c8bca341291",
      "loadPosition": "A1",
      "loadTimestamp": 1759306017560
    },
    {
      "loadType": "BLUE",
      "loadId": "042c88ca341291",
      "loadPosition": "A2",
      "loadTimestamp": 1759311410175
    },
    {
      "loadType": "",
      "loadId": "",
      "loadPosition": "A3",
      "loadTimestamp": 0
    },
    {
      "loadType": "WHITE",
      "loadId": "047b8bca341291",
      "loadPosition": "B1",
      "loadTimestamp": 1759312460464
    },
    {
      "loadType": "RED",
      "loadId": "040a8dca341291",
      "loadPosition": "B2",
      "loadTimestamp": 1759312722565
    },
    {
      "loadType": "WHITE",
      "loadId": "04798eca341290",
      "loadPosition": "B3",
      "loadTimestamp": 1759220882441
    },
    {
      "loadType": "",
      "loadId": "",
      "loadPosition": "C1",
      "loadTimestamp": 0
    },
    {
      "loadType": "RED",
      "loadId": "04fa8cca341290",
      "loadPosition": "C2",
      "loadTimestamp": 1759220673440
    },
    {
      "loadType": "RED",
      "loadId": "04808dca341291",
      "loadPosition": "C3",
      "loadTimestamp": 1759221461166
    }
  ],
  "actionState": {
    "id": "bce1f53c-065c-4dd9-ad87-e2ac6cbc265d",
    "command": "PICK",
    "metadata": {
      "type": "BLUE",
      "workpieceId": "047389ca341291"
    },
    "state": "RUNNING"
  },
  "serialNumber": "SVR3QA0022",
  "timestamp": "2025-10-01T10:06:46.872Z",
  "errors": [],
  "orderUpdateId": 3,
  "orderId": "8b54cc26-e37b-4428-887e-35da7fb574fd",
  "paused": false,
  "operatingMode": "AUTOMATIC",
  "metadata": {
    "opcuaState": "connected"
  },
  "information": []
}