{
  "headerId": 77,
  "loads": [
    {
      "loadType": "WHITE",
      "loadId": "047c8bca341291",
      "loadPosition": "A1",
      "loadTimestamp": 1759306017560
    },
    {
      "loadType": "RED",
      "loadId": "04fa8cca341290",
      "loadPosition": "A2",
      "loadTimestamp": 1759317370722
    },
    {
      "loadType": "",
      "loadId": "",
      "loadPosition": "A3",
      "loadTimestamp": 0
    },
    {
      "loadType": "WHITE",
      "loadId": "047b8bca341291",
      "loadPosition": "B1",
      "loadTimestamp": 1759312460464
    },
    {
      "loadType": "",
      "loadId": "",
      "loadPosition": "B2",
      "loadTimestamp": 0
    },
    {
      "loadType": "WHITE",
      "loadId": "04798eca341290",
      "loadPosition": "B3",
      "loadTimestamp": 1759220882441
    },
    {
      "loadType": "BLUE",
      "loadId": "047389ca341291",
      "loadPosition": "C1",
      "loadTimestamp": 1759313206785
    },
    {
      "loadType": "RED",
      "loadId": "04d78cca341290",
      "loadPosition": "C2",
      "loadTimestamp": 1759317444182
    },
    {
      "loadType": "",
      "loadId": "",
      "loadPosition": "C3",
      "loadTimestamp": 0
    }
  ],
  "actionState": {
    "id": "a3ebfeb0-d269-4d3f-8a69-2c4651c07477",
    "command": "DROP",
    "metadata": {
      "type": "RED"
    },
    "state": "RUNNING"
  },
  "serialNumber": "SVR3QA0022",
  "timestamp": "2025-10-01T11:21:45.286Z",
  "errors": [],
  "orderUpdateId": 1,
  "orderId": "5acf1a80-07e7-4c80-a128-e6739e681665",
  "paused": false,
  "operatingMode": "AUTOMATIC",
  "metadata": {
    "opcuaState": "connected"
  },
  "information": []
}