{
  "headerId": 580,
  "loads": [
    {
      "type": "WHITE"
    }
  ],
  "actionState": {
    "result": "047b8bca341291",
    "id": "0",
    "timestamp": "2025-10-01T09:53:50.949851Z",
    "metadata": {
      "type": "WHITE"
    },
    "command": "RGB_NFC",
    "state": "FINISHED"
  },
  "serialNumber": "SVR4H73275",
  "timestamp": "2025-10-01T09:53:51.968Z",
  "errors": [
    {}
  ],
  "orderUpdateId": 0,
  "orderId": "0",
  "paused": false,
  "metadata": {
    "opcuaState": "connected"
  }
}