{
  "headerId": 1,
  "loads": [],
  "actionState": {
    "id": "1e0831c8-1570-4734-ae45-2e9ee19b9c46",
    "state": "FINISHED",
    "command": "factsheetRequest",
    "metadata": {}
  },
  "serialNumber": "SVR4H76530",
  "timestamp": "2025-10-01T11:29:58.883Z",
  "errors": [],
  "orderUpdateId": 0,
  "paused": false,
  "metadata": {
    "opcuaState": "connected"
  }
}