{
  "headerId": 123,
  "loads": [
    {
      "loadType": "BLUE"
    }
  ],
  "actionState": {
    "command": "DROP",
    "id": "fd65d7e3-81af-4413-9dea-5817e9c66495",
    "metadata": {
      "type": "BLUE",
      "workpieceId": "048989ca341290"
    },
    "state": "RUNNING"
  },
  "serialNumber": "SVR4H76530",
  "timestamp": "2025-10-01T10:03:34.574Z",
  "errors": [],
  "orderUpdateId": 0,
  "orderId": "73e83f6f-71b2-4e1c-b665-1e72ab0d3d6f",
  "paused": false,
  "metadata": {
    "opcuaState": "connected"
  }
}