{
  "headerId": 91,
  "loads": [
    {
      "type": "RED"
    }
  ],
  "actionState": {
    "id": "4b76a44d-1a47-4e71-9492-b1051468c0fb",
    "state": "RUNNING"
  },
  "serialNumber": "SVR4H73275",
  "timestamp": "2025-10-01T11:32:48.724Z",
  "errors": [],
  "orderUpdateId": 0,
  "orderId": "e35d0f89-8cc5-4672-84bf-d408b31ea121",
  "paused": false,
  "metadata": {
    "opcuaState": "connected"
  }
}