{
  "headerId": 114,
  "loads": [
    {
      "loadType": "BLUE"
    }
  ],
  "actionState": {
    "command": "PICK",
    "id": "c654c771-7d04-4f2f-972b-fd3a4d5776d2",
    "state": "FINISHED",
    "duration": 5
  },
  "serialNumber": "SVR4H76449",
  "timestamp": "2025-10-01T10:01:58.911Z",
  "errors": [],
  "orderUpdateId": 3,
  "orderId": "73e83f6f-71b2-4e1c-b665-1e72ab0d3d6f",
  "paused": false,
  "metadata": {
    "opcuaState": "connected"
  }
}