{
  "headerId": 147,
  "loads": [
    {
      "loadType": "BLUE"
    }
  ],
  "actionState": {
    "command": "PICK",
    "id": "179e67c3-d6d9-42eb-b507-468c1ffb9aeb",
    "state": "RUNNING",
    "duration": 5
  },
  "serialNumber": "SVR4H76449",
  "timestamp": "2025-10-01T10:08:52.500Z",
  "errors": [],
  "orderUpdateId": 3,
  "orderId": "c30970ac-cd22-42a2-8484-923dd5398371",
  "paused": false,
  "metadata": {
    "opcuaState": "connected"
  }
}