{
  "headerId": 100,
  "loads": [
    {
      "loadType": "WHITE",
      "loadId": "047c8bca341291",
      "loadPosition": "A1",
      "loadTimestamp": 1759306017560
    },
    {
      "loadType": "BLUE",
      "loadId": "042c88ca341291",
      "loadPosition": "A2",
      "loadTimestamp": 1759311410175
    },
    {
      "loadType": "",
      "loadId": "",
      "loadPosition": "A3",
      "loadTimestamp": 0
    },
    {
      "loadType": "WHITE",
      "loadId": "047b8bca341291",
      "loadPosition": "B1",
      "loadTimestamp": 1759312460464
    },
    {
      "loadType": "",
      "loadId": "",
      "loadPosition": "B2",
      "loadTimestamp": 0
    },
    {
      "loadType": "WHITE",
      "loadId": "04798eca341290",
      "loadPosition": "B3",
      "loadTimestamp": 1759220882441
    },
    {
      "loadType": "BLUE",
      "loadId": "048989ca341290",
      "loadPosition": "C1",
      "loadTimestamp": 1759307106558
    },
    {
      "loadType": "RED",
      "loadId": "04fa8cca341290",
      "loadPosition": "C2",
      "loadTimestamp": 1759220673440
    },
    {
      "loadType": "RED",
      "loadId": "04808dca341291",
      "loadPosition": "C3",
      "loadTimestamp": 1759221461166
    }
  ],
  "actionState": {
    "id": "f9a58606-e76a-4cdd-9bc0-8c089fb5537c",
    "command": "PICK",
    "metadata": {
      "type": "RED",
      "workpieceId": "040a8dca341291"
    },
    "state": "RUNNING"
  },
  "serialNumber": "SVR3QA0022",
  "timestamp": "2025-10-01T09:58:42.651Z",
  "errors": [],
  "orderUpdateId": 3,
  "orderId": "50fdbb01-1cf6-45c1-a24b-7171f9cab3e2",
  "paused": false,
  "operatingMode": "AUTOMATIC",
  "metadata": {
    "opcuaState": "connected"
  },
  "information": []
}